{
  "scene_id": "SC-004",
  "act": 1,
  "title": "Neden? Üç Rakip Açıklama",
  "scene_type": "explanation",
  "summary": "İnalcık'ın gerçek motivasyonu hiçbir zaman kesin olarak bilinemedi - kaynaklar üç farklı açıklama sunuyor, hiçbiri kanıtlanmış değil.",
  "source_text": "Peki İnalcık gerçekten neden bunu yaptı? Kaynaklar hemfikir değil. Bazıları gerçekten casus olabileceklerini söylüyor. Bazıları, valiye resmi unvanıyla değil sıradan adıyla hitap edilmesinin bir hakaret sayıldığını yazıyor. Bazıları ise işin aslında çok daha basit olduğunu düşünüyor: gözü, kervanın taşıdığı altın ve gümüşteydi. Tarihçiler bugün bile hangisinin doğru olduğunu bilmiyor.",
  "duration_estimate_s": 35,
  "emotion": "curious uncertainty",
  "importance": 0.8,
  "location": "Otrar iç kalesi",
  "time_of_day": "day",
  "weather": "cold",
  "characters": [
    "İnalcık"
  ],
  "continuity_from": "SC-003",
  "qa_status": "pending",
  "shots": [
    "SH-004-01",
    "SH-004-02",
    "SH-004-03"
  ]
}