{
  "scene_id": "SC-009",
  "act": 3,
  "title": "Beş Aylık Direniş",
  "scene_type": "action",
  "summary": "Otrar'ın dış şehri düşer ama İnalcık iç kaleye çekilip beş ay direnir - Moğollar onu diri yakalayıp aleni idam etmek istemektedir.",
  "source_text": "Aralık 1219'da başlayan kuşatma önce şehrin dış surlarını düşürdü. Ama İnalcık teslim olmadı. İç kaleye çekildi ve beş ay boyunca direndi. Moğollar onu diri istiyordu - halkın önünde, örnek olsun diye idam etmek için.",
  "duration_estimate_s": 35,
  "emotion": "grim endurance",
  "importance": 0.7,
  "location": "Otrar iç kalesi",
  "time_of_day": "night",
  "weather": "cold",
  "characters": [
    "İnalcık"
  ],
  "continuity_from": "SC-008",
  "qa_status": "pending",
  "shots": [
    "SH-009-01"
  ]
}